{
  "platform": {
    "name": "Mux",
    "slug": "mux",
    "organization": "Mux, Inc."
  },
  "category": "Communications, media, and social",
  "surface": {
    "name": "Stream videos in five minutes via cURL create asset",
    "selection_basis": "The official documentation presents this as the hosted path from account setup to Create a video asset. It reaches the requested first-success boundary without extending into post-success production work.",
    "alternatives_considered": []
  },
  "research_status": "complete",
  "researched_at": "2026-07-22",
  "official_docs_only": true,
  "entry_point": {
    "developer_intent": "Mux accepts the authenticated cURL request and creates a video asset from the supplied input URL.",
    "starting_url": "https://www.mux.com/docs/core/stream-video-files",
    "assumed_prior_state": [
      "The developer has no prior Mux setup for this journey.",
      "The journey starts at account creation and stops at the first documented successful outcome."
    ]
  },
  "documented_first_success": {
    "official_milestone": "Stream videos in five minutes / create asset",
    "normalized_outcome": "Mux accepts the authenticated cURL request and creates a video asset from the supplied input URL.",
    "observable_completion_signal": "The create-asset response contains an asset ID and asset data; processing begins for the supplied video.",
    "boundary_evidence": {
      "type": "demonstrated-terminal-state",
      "official_label_or_terminal_state": "The official documentation leads the developer to: Create a video asset.",
      "source_ids": [
        "S1"
      ]
    },
    "why_this_is_the_boundary": "This is the first observable happy-path result on the selected Stream videos in five minutes via cURL create asset surface; later configuration and production hardening occur after success.",
    "source_ids": [
      "S1"
    ]
  },
  "prerequisites": [
    {
      "order": 1,
      "type": "account",
      "requirement": "A Mux account.",
      "required": true,
      "source_ids": [
        "S1"
      ]
    },
    {
      "order": 2,
      "type": "credential",
      "requirement": "A Mux access token ID and secret with video permissions.",
      "required": true,
      "source_ids": [
        "S1"
      ]
    },
    {
      "order": 3,
      "type": "other",
      "requirement": "A publicly reachable video URL accepted by the documented example.",
      "required": true,
      "source_ids": [
        "S1"
      ]
    },
    {
      "order": 4,
      "type": "software",
      "requirement": "A terminal with cURL.",
      "required": true,
      "source_ids": [
        "S1"
      ]
    }
  ],
  "primary_path": [
    {
      "step_number": 1,
      "phase": "account",
      "actor": "developer",
      "interface": "browser",
      "action": "Create or sign in to Mux and open the dashboard.",
      "details": [],
      "input": "A new developer starting at account creation",
      "output": "Mux dashboard settings are accessible.",
      "success_signal": "Mux dashboard settings are accessible.",
      "failure_or_wait": "The path cannot continue until this documented requirement succeeds.",
      "required": true,
      "source_ids": [
        "S1"
      ]
    },
    {
      "step_number": 2,
      "phase": "configure",
      "actor": "developer",
      "interface": "console",
      "action": "Create or retrieve a Mux access token ID and secret for video.",
      "details": [],
      "input": "Output of the preceding step",
      "output": "Mux Video API credentials are available.",
      "success_signal": "Mux Video API credentials are available.",
      "failure_or_wait": "The path cannot continue until this documented requirement succeeds.",
      "required": true,
      "source_ids": [
        "S1"
      ]
    },
    {
      "step_number": 3,
      "phase": "execute",
      "actor": "developer",
      "interface": "api",
      "action": "Run the documented cURL POST to create an asset from a video URL using HTTP Basic authentication.",
      "details": [],
      "input": "Output of the preceding step",
      "output": "Mux returns an asset object with an ID.",
      "success_signal": "Mux returns an asset object with an ID.",
      "failure_or_wait": "The path cannot continue until this documented requirement succeeds.",
      "required": true,
      "source_ids": [
        "S1"
      ]
    },
    {
      "step_number": 4,
      "phase": "verify",
      "actor": "developer",
      "interface": "api",
      "action": "Confirm that the response contains the newly created asset ID and processing state.",
      "details": [],
      "input": "Output of the preceding step",
      "output": "A Mux asset ID is visible in the successful response.",
      "success_signal": "A Mux asset ID is visible in the successful response.",
      "failure_or_wait": "The path cannot continue until this documented requirement succeeds.",
      "required": true,
      "source_ids": [
        "S1"
      ]
    }
  ],
  "branches": [],
  "friction_gates": [
    {
      "at_step": 2,
      "type": "credential",
      "description": "The access token must include permission to create video assets.",
      "documented_requirement": true,
      "source_ids": [
        "S1"
      ]
    },
    {
      "at_step": 3,
      "type": "access",
      "description": "Mux must be able to fetch the supplied video URL.",
      "documented_requirement": true,
      "source_ids": [
        "S1"
      ]
    }
  ],
  "time_to_first_success": {
    "vendor_claim": false,
    "value": "not documented",
    "source_ids": []
  },
  "sources": [
    {
      "id": "S1",
      "title": "Create a video asset",
      "url": "https://www.mux.com/docs/core/stream-video-files",
      "official_domain": true,
      "source_type": "documentation",
      "accessed_at": "2026-07-22",
      "last_updated_if_shown": null,
      "sections_used": [
        "Create a video asset"
      ],
      "evidence_supported": [
        "Mux accepts the authenticated cURL request and creates a video asset from the supplied input URL.",
        "The create-asset response contains an asset ID and asset data; processing begins for the supplied video."
      ]
    }
  ],
  "uncertainties": [
    {
      "question": "Does the current fresh-account UI exactly match every navigation label in the documented Create a video asset path?",
      "impact": "Navigation wording may differ while the required outcome and boundary remain the same.",
      "reason_unresolved": "The official documentation establishes the journey but account-specific UI state can vary.",
      "checked_source_ids": [
        "S1"
      ]
    }
  ],
  "excluded_after_success": [
    "Waiting for playback readiness",
    "Building a player UI",
    "Live streaming"
  ],
  "candidate_paths": [],
  "candidate_path_gap": null
}
