{
  "platform": {
    "name": "Mailgun",
    "slug": "mailgun",
    "organization": "Sinch"
  },
  "category": "Communications, media, and social",
  "surface": {
    "name": "Quickstart: sandbox domain cURL send first email",
    "selection_basis": "The official documentation presents this as the hosted path from account setup to Send Your First Email. It reaches the requested first-success boundary without extending into post-success production work.",
    "alternatives_considered": []
  },
  "research_status": "complete",
  "researched_at": "2026-07-22",
  "official_docs_only": true,
  "entry_point": {
    "developer_intent": "Mailgun accepts the sandbox-domain cURL request and delivers the first email to an authorized recipient.",
    "starting_url": "https://documentation.mailgun.com/docs/mailgun/quickstart",
    "assumed_prior_state": [
      "The developer has no prior Mailgun setup for this journey.",
      "The journey starts at account creation and stops at the first documented successful outcome."
    ]
  },
  "documented_first_success": {
    "official_milestone": "Send Your First Email",
    "normalized_outcome": "Mailgun accepts the sandbox-domain cURL request and delivers the first email to an authorized recipient.",
    "observable_completion_signal": "The API returns a queued message response and the authorized recipient receives the email.",
    "boundary_evidence": {
      "type": "demonstrated-terminal-state",
      "official_label_or_terminal_state": "The official documentation leads the developer to: Send Your First Email.",
      "source_ids": [
        "S1"
      ]
    },
    "why_this_is_the_boundary": "This is the first observable happy-path result on the selected Quickstart: sandbox domain cURL send first email surface; later configuration and production hardening occur after success.",
    "source_ids": [
      "S1"
    ]
  },
  "prerequisites": [
    {
      "order": 1,
      "type": "account",
      "requirement": "A Mailgun account with its sandbox domain.",
      "required": true,
      "source_ids": [
        "S1"
      ]
    },
    {
      "order": 2,
      "type": "credential",
      "requirement": "The Mailgun API key shown for the account.",
      "required": true,
      "source_ids": [
        "S1"
      ]
    },
    {
      "order": 3,
      "type": "verification",
      "requirement": "A recipient address authorized for the sandbox domain.",
      "required": true,
      "source_ids": [
        "S1"
      ]
    },
    {
      "order": 4,
      "type": "software",
      "requirement": "A terminal with cURL.",
      "required": true,
      "source_ids": [
        "S1"
      ]
    }
  ],
  "primary_path": [
    {
      "step_number": 1,
      "phase": "account",
      "actor": "developer",
      "interface": "browser",
      "action": "Create or sign in to Mailgun and open the sandbox-domain quick start.",
      "details": [],
      "input": "A new developer starting at account creation",
      "output": "The sandbox domain and sending credentials are visible.",
      "success_signal": "The sandbox domain and sending credentials are visible.",
      "failure_or_wait": "The path cannot continue until this documented requirement succeeds.",
      "required": true,
      "source_ids": [
        "S1"
      ]
    },
    {
      "step_number": 2,
      "phase": "configure",
      "actor": "developer",
      "interface": "console",
      "action": "Authorize and verify the intended sandbox recipient if it is not already authorized.",
      "details": [],
      "input": "Output of the preceding step",
      "output": "The recipient is listed as authorized.",
      "success_signal": "The recipient is listed as authorized.",
      "failure_or_wait": "The path cannot continue until this documented requirement succeeds.",
      "required": true,
      "source_ids": [
        "S1"
      ]
    },
    {
      "step_number": 3,
      "phase": "execute",
      "actor": "developer",
      "interface": "api",
      "action": "Run the documented cURL message send against the sandbox domain using API authentication.",
      "details": [],
      "input": "Output of the preceding step",
      "output": "Mailgun returns a successful queued response.",
      "success_signal": "Mailgun returns a successful queued response.",
      "failure_or_wait": "The path cannot continue until this documented requirement succeeds.",
      "required": true,
      "source_ids": [
        "S1"
      ]
    },
    {
      "step_number": 4,
      "phase": "verify",
      "actor": "developer",
      "interface": "browser",
      "action": "Inspect the authorized recipient inbox and confirm delivery of the first message.",
      "details": [],
      "input": "Output of the preceding step",
      "output": "The sent message is visible in the inbox.",
      "success_signal": "The sent message is visible in the inbox.",
      "failure_or_wait": "The path cannot continue until this documented requirement succeeds.",
      "required": true,
      "source_ids": [
        "S1"
      ]
    }
  ],
  "branches": [],
  "friction_gates": [
    {
      "at_step": 2,
      "type": "verification",
      "description": "Sandbox domains send only to authorized recipients, who may need to complete email verification.",
      "documented_requirement": true,
      "source_ids": [
        "S1"
      ]
    },
    {
      "at_step": 3,
      "type": "wait",
      "description": "Email delivery can be delayed or filtered by the recipient provider.",
      "documented_requirement": true,
      "source_ids": [
        "S1"
      ]
    }
  ],
  "time_to_first_success": {
    "vendor_claim": false,
    "value": "not documented",
    "source_ids": []
  },
  "sources": [
    {
      "id": "S1",
      "title": "Send Your First Email",
      "url": "https://documentation.mailgun.com/docs/mailgun/quickstart",
      "official_domain": true,
      "source_type": "documentation",
      "accessed_at": "2026-07-22",
      "last_updated_if_shown": null,
      "sections_used": [
        "Send Your First Email"
      ],
      "evidence_supported": [
        "Mailgun accepts the sandbox-domain cURL request and delivers the first email to an authorized recipient.",
        "The API returns a queued message response and the authorized recipient receives the email."
      ]
    }
  ],
  "uncertainties": [
    {
      "question": "Does the current fresh-account UI exactly match every navigation label in the documented Send Your First Email path?",
      "impact": "Navigation wording may differ while the required outcome and boundary remain the same.",
      "reason_unresolved": "The official documentation establishes the journey but account-specific UI state can vary.",
      "checked_source_ids": [
        "S1"
      ]
    }
  ],
  "excluded_after_success": [
    "Adding a custom sending domain",
    "DNS verification for production",
    "SMTP integration"
  ],
  "candidate_paths": [],
  "candidate_path_gap": null
}
