{
  "platform": {
    "name": "Airbyte",
    "slug": "airbyte",
    "organization": "Airbyte, Inc."
  },
  "category": "Data pipelines and workflow automation",
  "surface": {
    "name": "Airbyte Cloud Sample Data source to first successful sync",
    "selection_basis": "Airbyte Cloud is the hosted onboarding path. Official docs direct developers who do not want to self-manage to cloud.airbyte.com/signup, and the getting-started source guide uses Marketplace Sample Data as the popular test source before destination and connection setup. PyAirbyte and local Core are local/self-managed alternatives, not the Cloud onboarding path.",
    "alternatives_considered": [
      {
        "name": "PyAirbyte local read",
        "url": "https://docs.airbyte.com/platform/using-airbyte/getting-started/oss-quickstart",
        "reason_not_primary": "Local Python toolkit without Cloud account onboarding."
      },
      {
        "name": "Airbyte Core abctl local",
        "url": "https://docs.airbyte.com/platform/using-airbyte/getting-started/oss-quickstart",
        "reason_not_primary": "Self-managed Docker/Kubernetes path; quickstart says skip it and sign up for Cloud to start syncing now."
      }
    ]
  },
  "research_status": "complete",
  "researched_at": "2026-07-22",
  "official_docs_only": true,
  "entry_point": {
    "developer_intent": "Create an Airbyte Cloud trial workspace, configure Sample Data, add a destination, and complete a first successful sync.",
    "starting_url": "https://cloud.airbyte.com/signup",
    "assumed_prior_state": [
      "No Airbyte Cloud account or workspace exists.",
      "A browser is available; no local Docker or Python SDK is assumed."
    ]
  },
  "documented_first_success": {
    "official_milestone": "First successful sync",
    "normalized_outcome": "An Airbyte Cloud connection completes a successful sync from Sample Data into a configured destination.",
    "observable_completion_signal": "The connection page shows a successful sync status after Set up connection and initiating a sync.",
    "boundary_evidence": {
      "type": "demonstrated-terminal-state",
      "official_label_or_terminal_state": "Cloud trial begins after first successful sync; add-source and add-connection guides end at initiating syncs from the connection page.",
      "source_ids": [
        "S1",
        "S2",
        "S3"
      ]
    },
    "why_this_is_the_boundary": "Cloud onboarding is complete when data moves: trial credits start after the first successful sync. Credential visibility alone is not first success.",
    "source_ids": [
      "S1",
      "S2",
      "S3"
    ]
  },
  "prerequisites": [
    {
      "order": 1,
      "type": "account",
      "requirement": "Airbyte Cloud account via cloud.airbyte.com/signup.",
      "required": true,
      "source_ids": [
        "S1"
      ]
    },
    {
      "order": 2,
      "type": "software",
      "requirement": "Supported browser to use the Cloud UI.",
      "required": true,
      "source_ids": [
        "S2"
      ]
    }
  ],
  "primary_path": [
    {
      "step_number": 1,
      "phase": "account",
      "actor": "developer",
      "interface": "browser",
      "action": "Sign up for Airbyte Cloud and open the workspace.",
      "details": [],
      "input": "Email and organization details",
      "output": "Authenticated Cloud workspace",
      "success_signal": "Sources and Destinations navigation is reachable.",
      "failure_or_wait": "",
      "required": true,
      "source_ids": [
        "S1"
      ]
    },
    {
      "step_number": 2,
      "phase": "configure",
      "actor": "developer",
      "interface": "console",
      "action": "Add a Sample Data source from Marketplace and complete Set up source so the connection test succeeds.",
      "details": [
        "Docs recommend Sample Data when unsure which source to pick."
      ],
      "input": "Empty workspace",
      "output": "Validated Sample Data source",
      "success_signal": "Source test succeeds and New Connection is offered.",
      "failure_or_wait": "",
      "required": true,
      "source_ids": [
        "S2"
      ]
    },
    {
      "step_number": 3,
      "phase": "configure",
      "actor": "developer",
      "interface": "console",
      "action": "Add a destination connector and complete its setup test.",
      "details": [],
      "input": "Validated source",
      "output": "Validated destination",
      "success_signal": "Destination connection test succeeds.",
      "failure_or_wait": "",
      "required": true,
      "source_ids": [
        "S3"
      ]
    },
    {
      "step_number": 4,
      "phase": "configure",
      "actor": "developer",
      "interface": "console",
      "action": "Create a connection linking the source and destination, configure schema, and click Set up connection.",
      "details": [],
      "input": "Source and destination",
      "output": "Configured connection",
      "success_signal": "Connection detail page is open.",
      "failure_or_wait": "",
      "required": true,
      "source_ids": [
        "S3"
      ]
    },
    {
      "step_number": 5,
      "phase": "execute",
      "actor": "developer",
      "interface": "console",
      "action": "Initiate a sync from the connection page.",
      "details": [],
      "input": "Configured connection",
      "output": "Sync job",
      "success_signal": "Sync starts.",
      "failure_or_wait": "",
      "required": true,
      "source_ids": [
        "S3"
      ]
    },
    {
      "step_number": 6,
      "phase": "verify",
      "actor": "developer",
      "interface": "console",
      "action": "Confirm the sync completes successfully.",
      "details": [],
      "input": "Sync job",
      "output": "Verified first Cloud sync",
      "success_signal": "Connection shows successful sync status.",
      "failure_or_wait": "",
      "required": true,
      "source_ids": [
        "S1",
        "S3"
      ]
    }
  ],
  "branches": [],
  "friction_gates": [
    {
      "at_step": 1,
      "type": "account",
      "description": "Cloud signup is required before connectors and syncs.",
      "documented_requirement": true,
      "source_ids": [
        "S1"
      ]
    }
  ],
  "time_to_first_success": {
    "vendor_claim": false,
    "value": "not documented",
    "source_ids": []
  },
  "sources": [
    {
      "id": "S1",
      "title": "Manage billing and credits (Start a trial)",
      "url": "https://docs.airbyte.com/platform/cloud/managing-airbyte-cloud/manage-credits",
      "official_domain": true,
      "source_type": "documentation",
      "accessed_at": "2026-07-22",
      "last_updated_if_shown": null,
      "sections_used": [
        "Start a trial"
      ],
      "evidence_supported": [
        "cloud.airbyte.com/signup",
        "Trial begins after first successful sync"
      ]
    },
    {
      "id": "S2",
      "title": "Add and manage sources",
      "url": "https://docs.airbyte.com/platform/using-airbyte/getting-started/add-a-source",
      "official_domain": true,
      "source_type": "documentation",
      "accessed_at": "2026-07-22",
      "last_updated_if_shown": null,
      "sections_used": [
        "Add a source connector",
        "Sample Data"
      ],
      "evidence_supported": [
        "Marketplace Sample Data",
        "Set up source connection test"
      ]
    },
    {
      "id": "S3",
      "title": "Add a connection",
      "url": "https://docs.airbyte.com/platform/move-data/add-connection",
      "official_domain": true,
      "source_type": "documentation",
      "accessed_at": "2026-07-22",
      "last_updated_if_shown": null,
      "sections_used": [
        "Create an ELT connection",
        "Set up connection"
      ],
      "evidence_supported": [
        "New connection",
        "Initiate syncs"
      ]
    }
  ],
  "uncertainties": [
    {
      "question": "Which destination does Cloud onboarding recommend first for Sample Data on a brand-new trial?",
      "impact": "Destination choice adds connector-specific fields.",
      "reason_unresolved": "Add-connection docs require a destination but do not mandate one specific first destination for Sample Data.",
      "checked_source_ids": [
        "S2",
        "S3"
      ]
    }
  ],
  "excluded_after_success": [
    "PyAirbyte",
    "abctl local Core",
    "Custom connector builder"
  ],
  "candidate_paths": [],
  "candidate_path_gap": null
}
